<?xml version="1.0" encoding="UTF-8"?>
<xs:schema xmlns:xs="http://www.w3.org/2001/XMLSchema">
    <xs:element name="TestFile" >
        <xs:complexType>
            <xs:sequence>
                <xs:element ref="TestOp" minOccurs="0" maxOccurs="unbounded" />
            </xs:sequence>
            <xs:attribute name="useInitialState" type="xs:boolean" default="false" />
        </xs:complexType>
    </xs:element>



    <xs:element name="TestOp">
        <xs:complexType>
            <xs:sequence>
                <xs:element name="Command" type="xs:string" />
                <xs:element name="Return" type="xs:string" />
                <xs:element type="xs:boolean" name="CheckReturn"/>
            </xs:sequence>
        </xs:complexType>
    </xs:element>

</xs:schema>